<?xml version="1.0" encoding="UTF-8"?>

<!-- generated on Thu Oct  4 15:30:19 2012 by SUMO netconvert Version dev-SVN-r12771
<?xml version="1.0" encoding="UTF-8"?>

<configuration xmlns:xsi="http://www.w3.org/2001/XMLSchema-instance" xsi:noNamespaceSchemaLocation="http://sumo.sf.net/xsd/netconvertConfiguration.xsd">

    <input>
        <sumo-net-file value="bottleneck.net.xml"/>
    </input>

    <output>
        <output-file value="net.net.xml"/>
    </output>

    <processing>
        <no-internal-links value="true"/>
        <no-turnarounds value="true"/>
        <offset.disable-normalization value="true"/>
    </processing>

</configuration>
-->

<net version="0.13" xmlns:xsi="http://www.w3.org/2001/XMLSchema-instance" xsi:noNamespaceSchemaLocation="http://sumo.sf.net/xsd/net_file.xsd">

    <location netOffset="0.00,0.00" convBoundary="-500.00,-100.00,500.00,100.00" origBoundary="-10000000000.00,-10000000000.00,10000000000.00,10000000000.00" projParameter="!"/>

    <edge id="in1" from="gneJ0" to="gneJ1" priority="1">
        <lane id="in1_0" index="0" speed="13.89" length="500.73" shape="-500.32,98.38 -9.32,0.18"/>
    </edge>
    <edge id="in2" from="gneJ2" to="gneJ1" priority="1">
        <lane id="in2_0" index="0" speed="13.89" length="500.07" shape="-499.68,-101.62 -9.32,-3.55"/>
    </edge>
    <edge id="out" from="gneJ1" to="gneJ3" priority="1">
        <lane id="out_0" index="0" speed="13.89" length="498.50" shape="1.50,-1.65 500.00,-1.65"/>
    </edge>

    <junction id="gneJ0" type="unregulated" x="-500.00" y="100.00" incLanes="" intLanes="" shape="-500.01,99.95 -500.64,96.81">
    </junction>
    <junction id="gneJ1" type="priority" x="0.00" y="0.00" incLanes="in2_0 in1_0" intLanes="" shape="1.50,-0.05 1.50,-3.25 -9.00,-5.11 -9.63,-1.98 -9.63,-1.39 -9.00,1.75">
        <request index="0" response="00" foes="10"/>
        <request index="1" response="01" foes="01"/>
    </junction>
    <junction id="gneJ2" type="unregulated" x="-500.00" y="-100.00" incLanes="" intLanes="" shape="-499.99,-100.05 -499.36,-103.19">
    </junction>
    <junction id="gneJ3" type="unregulated" x="500.00" y="0.00" incLanes="out_0" intLanes="" shape="500.00,-3.25 500.00,-0.05">
    </junction>

    <connection from="in1" to="out" fromLane="0" toLane="0" dir="s" state="m"/>
    <connection from="in2" to="out" fromLane="0" toLane="0" dir="s" state="M"/>

</net>
